{
  "observation_version": "aau-cpython-workspace-observation/0.1",
  "capture_mode": "cpython_audit_workspace_reads",
  "observer": {
    "observer_version": "aau-cpython-workspace-observer/0.1",
    "pack_path": "runtime-observer.artifact",
    "size_bytes": 7624,
    "sha256": "ac8314b4674e95453b44965956b959a3477da542dbdc56cb13620ce485f83da4"
  },
  "expected_session_count": 12,
  "observed_session_count": 12,
  "materials": [
    {
      "path": "agent-side-effect-ledger/aau_side_effect.py",
      "size_bytes": 46646,
      "sha256": "564d16f27f6977378cf27bd4c8a769db081c0171cad4b321e724a25a6779d259",
      "event_kinds": [
        "code"
      ]
    },
    {
      "path": "agent-side-effect-ledger/examples/reference-runtime-policy.json",
      "size_bytes": 131,
      "sha256": "bde2a75cf512c360fcf791c22015f5d44b63b5194023b625f64acf356c0c618a",
      "event_kinds": [
        "read"
      ]
    },
    {
      "path": "agent-side-effect-ledger/examples/reference_adapter.py",
      "size_bytes": 1658,
      "sha256": "f3bc78226a2a701e7f7b5b3d1fc9e1bc593bb746184e0552758a3c91b7bf46cf",
      "event_kinds": [
        "code"
      ]
    }
  ],
  "runtime_only_paths": [
    "agent-side-effect-ledger/examples/reference-runtime-policy.json"
  ],
  "unobserved_static_paths": [],
  "capabilities": [
    "dynamic_code"
  ],
  "boundaries": {
    "cpython_events_are_implementation_specific": true,
    "digest_sample_precedes_application_open": true,
    "no_interpreter_installed_package_environment_container_or_workload_identity": true,
    "outside_workspace_arguments_not_recorded": true,
    "python_level_audit_hook_is_not_a_sandbox": true,
    "runtime_only_bytes_not_embedded": true,
    "toctou_window_remains": true,
    "trusted_adapter_can_bypass_or_tamper_with_observation": true,
    "workspace_regular_files_only": true
  },
  "observation_sha256": "73bf3e5f55b007b729d5533f66ff5d114b720a121539997e6f1af1ff529ab3e8"
}
