{
  "observation_version": "aau-cpython-workspace-observation/0.1",
  "capture_mode": "cpython_audit_workspace_reads",
  "observer": {
    "observer_version": "aau-cpython-workspace-observer/0.1",
    "pack_path": "runtime-observer.artifact",
    "size_bytes": 7624,
    "sha256": "ac8314b4674e95453b44965956b959a3477da542dbdc56cb13620ce485f83da4"
  },
  "expected_session_count": 24,
  "observed_session_count": 24,
  "materials": [
    {
      "path": "agent-side-effect-ledger/aau_crash_lab.py",
      "size_bytes": 19817,
      "sha256": "1eb5e45bfa0ddccd57adc47b55ae09cb5ad2da44dfdc503bb78793b1d0892590",
      "event_kinds": [
        "code"
      ]
    },
    {
      "path": "agent-side-effect-ledger/aau_side_effect.py",
      "size_bytes": 45500,
      "sha256": "52f378b15d43fc996518866353304027edea08beb0828dca7d7b9fbf36537a7b",
      "event_kinds": [
        "code"
      ]
    },
    {
      "path": "agent-side-effect-ledger/examples/reference-runtime-policy.json",
      "size_bytes": 131,
      "sha256": "bde2a75cf512c360fcf791c22015f5d44b63b5194023b625f64acf356c0c618a",
      "event_kinds": [
        "read"
      ]
    },
    {
      "path": "agent-side-effect-ledger/examples/reference_crash_adapter.py",
      "size_bytes": 7332,
      "sha256": "7a17dd8f7a2c37b387e6375fc67f681314b4f1b47843bb0f172d97e7cc6e4cb1",
      "event_kinds": [
        "code"
      ]
    }
  ],
  "runtime_only_paths": [
    "agent-side-effect-ledger/examples/reference-runtime-policy.json"
  ],
  "unobserved_static_paths": [],
  "capabilities": [
    "dynamic_code"
  ],
  "boundaries": {
    "cpython_events_are_implementation_specific": true,
    "digest_sample_precedes_application_open": true,
    "no_interpreter_installed_package_environment_container_or_workload_identity": true,
    "outside_workspace_arguments_not_recorded": true,
    "python_level_audit_hook_is_not_a_sandbox": true,
    "runtime_only_bytes_not_embedded": true,
    "toctou_window_remains": true,
    "trusted_adapter_can_bypass_or_tamper_with_observation": true,
    "workspace_regular_files_only": true
  },
  "observation_sha256": "4ffd90d826db5da851d9ee48254f60848a6b342489974225ce67b26ff4936d91"
}
